<?xml version="1.0" encoding="UTF-8"?>
<!DOCTYPE root SYSTEM "school.dtd">
<root type="database">
    <students type="table">
        <student>
            <name>Maria</name>
            <surname>Longstorm</surname>
            <age>18</age>
            <course>1B</course>
        </student>
        <student>
            <name>John</name>
            <surname>Bluefield</surname>
            <age>17</age>
            <course>1B</course>
        </student>
    </students>
    <teachers type="table">
        <teacher type="row" tutor="yes">
            <name>Emmie</name>
            <surname>Fastbelt</surname>
            <age>35</age>
            <group>1A</group>
        </teacher>
        <teacher type="row" tutor="yes">
            <name>Ernald</name>
            <surname>Softson</surname>
            <age>23</age>
            <group>1B</group>
        </teacher>
    </teachers>
    <rooms type="table">
        <room type="subtable">
            <name>Hall</name>
            <capacity>40</capacity>
        </room>
    </rooms>
</root>